{
  "name": "shutter_speed_add",
  "style": "outlined",
  "viewBox": "0 -960 960 960",
  "paths": {
    "fill0": "M720-40v-120H600v-80h120v-120h80v120h120v80H800v120h-80ZM360-840v-80h240v80H360ZM480-80q-75 0-140.5-28.5t-114-77q-48.5-48.5-77-114T120-440q0-75 28.5-140.5t77-114q48.5-48.5 114-77T480-800q64 0 121 21t104 58l57-57 56 56-56 58q39 49 59.5 109T840-427q-14-4-31-9t-49-5q0-10-.5-19.5T757-480H596L416-167q16 4 31.5 5.5T480-160q11 0 21-.5t21-2.5q3 20 9.5 40T548-86q-17 3-34 4.5T480-80Zm0-440h268q-18-62-61.5-109T584-700L480-520Zm-70 40 134-232q-16-4-32.5-6t-33.5-2q-45 0-89 14.5T306-660l104 180Zm-206 80h206L276-632q-42 47-62.5 106.5T204-400Zm172 220 104-180H212q18 62 61.5 109T376-180Zm104-260Zm42 277Zm238-278Z",
    "fill1": "M720-40v-120H600v-80h120v-120h80v120h120v80H800v120h-80ZM360-840v-80h240v80H360ZM480-80q-75 0-140.5-28.5T225-186q-49-49-77-114.5T120-440q0-74 28.5-139.5T226-694q49-49 114.5-77.5T480-800q63 0 120 21t104 59l58-58 56 56-56 58q38 49 59 109.5T840-427q-14-5-35.5-9t-44.5-4q0-116-82-198t-198-82q-117 0-198.5 81.5T200-440q0 117 81.5 198.5T480-160q11 0 21-.5t21-2.5q3 20 9.5 39.5T548-86q-17 3-34 4.5T480-80Zm40-123q1-45 16.5-84t42.5-70q27-31 63-51.5t78-28.5q0-11-1-21.5t-3-21.5H597L436-204q18 4 44 3.5t40-2.5Zm-40-317h226q-18-51-56-89.5T564-665l-84 145Zm-69 40 113-196q-51-10-102.5 3T327-625l84 145Zm-167 80h167L298-596q-35 39-49 90.5T244-400Zm152 185 84-145H254q17 50 55.5 89t86.5 56Z"
  },
  "tags": [
    "shutter",
    "speed",
    "add"
  ]
}
