{
  "name": "commit",
  "style": "sharp",
  "viewBox": "0 -960 960 960",
  "paths": {
    "fill0": "M352.5-325.5Q298-371 284-440H80v-80h204q14-69 68.5-114.5T480-680q73 0 127.5 45.5T676-520h204v80H676q-14 69-68.5 114.5T480-280q-73 0-127.5-45.5ZM480-360q50 0 85-35t35-85q0-50-35-85t-85-35q-50 0-85 35t-35 85q0 50 35 85t85 35Z",
    "fill1": "M352.5-325.5Q298-371 284-440H80v-80h204q14-69 68.5-114.5T480-680q73 0 127.5 45.5T676-520h204v80H676q-14 69-68.5 114.5T480-280q-73 0-127.5-45.5ZM480-360q50 0 85-35t35-85q0-50-35-85t-85-35q-50 0-85 35t-35 85q0 50 35 85t85 35Z"
  },
  "tags": [
    "commit"
  ]
}
