{
  "name": "face_5",
  "style": "sharp",
  "viewBox": "0 -960 960 960",
  "paths": {
    "fill0": "M466-726q-6-6-6-14t6-14q6-6 14-6t14 6q6 6 6 14t-6 14q-6 6-14 6t-14-6Zm80 0q-6-6-6-14t6-14q6-6 14-6t14 6q6 6 6 14t-6 14q-6 6-14 6t-14-6Zm-160 0q-6-6-6-14t6-14q6-6 14-6t14 6q6 6 6 14t-6 14q-6 6-14 6t-14-6Zm280 40q-6-6-6-14t6-14q6-6 14-6t14 6q6 6 6 14t-6 14q-6 6-14 6t-14-6Zm-320 0q-6-6-6-14t6-14q6-6 14-6t14 6q6 6 6 14t-6 14q-6 6-14 6t-14-6Zm-80 0q-6-6-6-14t6-14q6-6 14-6t14 6q6 6 6 14t-6 14q-6 6-14 6t-14-6Zm160 0q-6-6-6-14t6-14q6-6 14-6t14 6q6 6 6 14t-6 14q-6 6-14 6t-14-6Zm80 0q-6-6-6-14t6-14q6-6 14-6t14 6q6 6 6 14t-6 14q-6 6-14 6t-14-6Zm80 0q-6-6-6-14t6-14q6-6 14-6t14 6q6 6 6 14t-6 14q-6 6-14 6t-14-6Zm-120 40q-6-6-6-14t6-14q6-6 14-6t14 6q6 6 6 14t-6 14q-6 6-14 6t-14-6Zm80 0q-6-6-6-14t6-14q6-6 14-6t14 6q6 6 6 14t-6 14q-6 6-14 6t-14-6Zm80 0q-6-6-6-14t6-14q6-6 14-6t14 6q6 6 6 14t-6 14q-6 6-14 6t-14-6Zm-240 0q-6-6-6-14t6-14q6-6 14-6t14 6q6 6 6 14t-6 14q-6 6-14 6t-14-6Zm-80 0q-6-6-6-14t6-14q6-6 14-6t14 6q6 6 6 14t-6 14q-6 6-14 6t-14-6Zm40 40q-6-6-6-14t6-14q6-6 14-6t14 6q6 6 6 14t-6 14q-6 6-14 6t-14-6Zm-80 0q-6-6-6-14t6-14q6-6 14-6t14 6q6 6 6 14t-6 14q-6 6-14 6t-14-6Zm160 0q-6-6-6-14t6-14q6-6 14-6t14 6q6 6 6 14t-6 14q-6 6-14 6t-14-6Zm80 0q-6-6-6-14t6-14q6-6 14-6t14 6q6 6 6 14t-6 14q-6 6-14 6t-14-6Zm80 0q-6-6-6-14t6-14q6-6 14-6t14 6q6 6 6 14t-6 14q-6 6-14 6t-14-6Zm80 0q-6-6-6-14t6-14q6-6 14-6t14 6q6 6 6 14t-6 14q-6 6-14 6t-14-6Zm-480 0q-6-6-6-14t6-14q6-6 14-6t14 6q6 6 6 14t-6 14q-6 6-14 6t-14-6Zm40-40q-6-6-6-14t6-14q6-6 14-6t14 6q6 6 6 14t-6 14q-6 6-14 6t-14-6Zm80-80q-6-6-6-14t6-14q6-6 14-6t14 6q6 6 6 14t-6 14q-6 6-14 6t-14-6Zm40-40q-6-6-6-14t6-14q6-6 14-6t14 6q6 6 6 14t-6 14q-6 6-14 6t-14-6Zm80 0q-6-6-6-14t6-14q6-6 14-6t14 6q6 6 6 14t-6 14q-6 6-14 6t-14-6Zm80 0q-6-6-6-14t6-14q6-6 14-6t14 6q6 6 6 14t-6 14q-6 6-14 6t-14-6Zm80 0q-6-6-6-14t6-14q6-6 14-6t14 6q6 6 6 14t-6 14q-6 6-14 6t-14-6Zm40 40q-6-6-6-14t6-14q6-6 14-6t14 6q6 6 6 14t-6 14q-6 6-14 6t-14-6Zm80 80q-6-6-6-14t6-14q6-6 14-6t14 6q6 6 6 14t-6 14q-6 6-14 6t-14-6Zm40 40q-6-6-6-14t6-14q6-6 14-6t14 6q6 6 6 14t-6 14q-6 6-14 6t-14-6ZM324.5-404.5Q310-419 310-440t14.5-35.5Q339-490 360-490t35.5 14.5Q410-461 410-440t-14.5 35.5Q381-390 360-390t-35.5-14.5Zm240 0Q550-419 550-440t14.5-35.5Q579-490 600-490t35.5 14.5Q650-461 650-440t-14.5 35.5Q621-390 600-390t-35.5-14.5ZM480-80q-82 0-155-31.5t-127.5-86Q143-252 111.5-325T80-480q0-83 31.5-156t86-127Q252-817 325-848.5T480-880q83 0 156 31.5T763-763q54 54 85.5 127T880-480q0 82-31.5 155T763-197.5q-54 54.5-127 86T480-80Zm0-80q134 0 227-93.5T800-480q0-134-93-227t-227-93q-133 0-226.5 93T160-480q0 133 93.5 226.5T480-160Z",
    "fill1": "M466-726q-6-6-6-14t6-14q6-6 14-6t14 6q6 6 6 14t-6 14q-6 6-14 6t-14-6Zm80 0q-6-6-6-14t6-14q6-6 14-6t14 6q6 6 6 14t-6 14q-6 6-14 6t-14-6Zm-160 0q-6-6-6-14t6-14q6-6 14-6t14 6q6 6 6 14t-6 14q-6 6-14 6t-14-6Zm280 40q-6-6-6-14t6-14q6-6 14-6t14 6q6 6 6 14t-6 14q-6 6-14 6t-14-6Zm-320 0q-6-6-6-14t6-14q6-6 14-6t14 6q6 6 6 14t-6 14q-6 6-14 6t-14-6Zm-80 0q-6-6-6-14t6-14q6-6 14-6t14 6q6 6 6 14t-6 14q-6 6-14 6t-14-6Zm160 0q-6-6-6-14t6-14q6-6 14-6t14 6q6 6 6 14t-6 14q-6 6-14 6t-14-6Zm80 0q-6-6-6-14t6-14q6-6 14-6t14 6q6 6 6 14t-6 14q-6 6-14 6t-14-6Zm80 0q-6-6-6-14t6-14q6-6 14-6t14 6q6 6 6 14t-6 14q-6 6-14 6t-14-6Zm-120 40q-6-6-6-14t6-14q6-6 14-6t14 6q6 6 6 14t-6 14q-6 6-14 6t-14-6Zm80 0q-6-6-6-14t6-14q6-6 14-6t14 6q6 6 6 14t-6 14q-6 6-14 6t-14-6Zm80 0q-6-6-6-14t6-14q6-6 14-6t14 6q6 6 6 14t-6 14q-6 6-14 6t-14-6Zm-240 0q-6-6-6-14t6-14q6-6 14-6t14 6q6 6 6 14t-6 14q-6 6-14 6t-14-6Zm-80 0q-6-6-6-14t6-14q6-6 14-6t14 6q6 6 6 14t-6 14q-6 6-14 6t-14-6Zm40 40q-6-6-6-14t6-14q6-6 14-6t14 6q6 6 6 14t-6 14q-6 6-14 6t-14-6Zm-80 0q-6-6-6-14t6-14q6-6 14-6t14 6q6 6 6 14t-6 14q-6 6-14 6t-14-6Zm160 0q-6-6-6-14t6-14q6-6 14-6t14 6q6 6 6 14t-6 14q-6 6-14 6t-14-6Zm80 0q-6-6-6-14t6-14q6-6 14-6t14 6q6 6 6 14t-6 14q-6 6-14 6t-14-6Zm80 0q-6-6-6-14t6-14q6-6 14-6t14 6q6 6 6 14t-6 14q-6 6-14 6t-14-6Zm80 0q-6-6-6-14t6-14q6-6 14-6t14 6q6 6 6 14t-6 14q-6 6-14 6t-14-6Zm-480 0q-6-6-6-14t6-14q6-6 14-6t14 6q6 6 6 14t-6 14q-6 6-14 6t-14-6Zm40-40q-6-6-6-14t6-14q6-6 14-6t14 6q6 6 6 14t-6 14q-6 6-14 6t-14-6Zm80-80q-6-6-6-14t6-14q6-6 14-6t14 6q6 6 6 14t-6 14q-6 6-14 6t-14-6Zm40-40q-6-6-6-14t6-14q6-6 14-6t14 6q6 6 6 14t-6 14q-6 6-14 6t-14-6Zm80 0q-6-6-6-14t6-14q6-6 14-6t14 6q6 6 6 14t-6 14q-6 6-14 6t-14-6Zm80 0q-6-6-6-14t6-14q6-6 14-6t14 6q6 6 6 14t-6 14q-6 6-14 6t-14-6Zm80 0q-6-6-6-14t6-14q6-6 14-6t14 6q6 6 6 14t-6 14q-6 6-14 6t-14-6Zm40 40q-6-6-6-14t6-14q6-6 14-6t14 6q6 6 6 14t-6 14q-6 6-14 6t-14-6Zm80 80q-6-6-6-14t6-14q6-6 14-6t14 6q6 6 6 14t-6 14q-6 6-14 6t-14-6Zm40 40q-6-6-6-14t6-14q6-6 14-6t14 6q6 6 6 14t-6 14q-6 6-14 6t-14-6ZM324.5-404.5Q310-419 310-440t14.5-35.5Q339-490 360-490t35.5 14.5Q410-461 410-440t-14.5 35.5Q381-390 360-390t-35.5-14.5Zm240 0Q550-419 550-440t14.5-35.5Q579-490 600-490t35.5 14.5Q650-461 650-440t-14.5 35.5Q621-390 600-390t-35.5-14.5ZM480-80q-82 0-155-31.5t-127.5-86Q143-252 111.5-325T80-480q0-83 31.5-156t86-127Q252-817 325-848.5T480-880q83 0 156 31.5T763-763q54 54 85.5 127T880-480q0 82-31.5 155T763-197.5q-54 54.5-127 86T480-80Zm0-80q134 0 227-93.5T800-480q0-134-93-227t-227-93q-133 0-226.5 93T160-480q0 133 93.5 226.5T480-160Z"
  },
  "tags": [
    "face",
    "5"
  ]
}
