{
  "name": "settings_system_daydream",
  "style": "outlined",
  "viewBox": "0 -960 960 960",
  "paths": {
    "fill0": "M360-320h260q42 0 71-29t29-71q0-42-29-71t-71-29h-2q-8-51-44.5-85.5T486-640q-42 0-78 21t-54 59h-5q-47 0-78 36t-31 84q0 50 35 85t85 35Zm0-80q-17 0-28.5-11.5T320-440q0-17 11.5-28.5T360-480h50v-10q0-29 20.5-49.5T480-560q29 0 49.5 20.5T550-490v50h70q8 0 14 6t6 14q0 8-6 14t-14 6H360ZM160-160q-33 0-56.5-23.5T80-240v-480q0-33 23.5-56.5T160-800h640q33 0 56.5 23.5T880-720v480q0 33-23.5 56.5T800-160H160Zm0-80h640v-480H160v480Zm0 0v-480 480Z",
    "fill1": "M360-320h260q42 0 71-29t29-71q0-42-29-71t-71-29h-2q-8-51-44.5-85.5T486-640q-42 0-78 21t-54 59h-5q-47 0-78 36t-31 84q0 50 35 85t85 35Zm120-160ZM160-160q-33 0-56.5-23.5T80-240v-480q0-33 23.5-56.5T160-800h640q33 0 56.5 23.5T880-720v480q0 33-23.5 56.5T800-160H160Z"
  },
  "tags": [
    "settings",
    "system",
    "daydream"
  ]
}
