{
  "name": "align_self_stretch",
  "style": "outlined",
  "viewBox": "0 -960 960 960",
  "paths": {
    "fill0": "M80-800v-80h800v80H80Zm0 720v-80h800v80H80Zm340-180v-460h120v460H420Z",
    "fill1": "M80-800v-80h800v80H80Zm0 720v-80h800v80H80Zm340-180v-460h120v460H420Z"
  },
  "tags": [
    "align",
    "self",
    "stretch"
  ]
}
