{
  "name": "encrypted",
  "style": "rounded",
  "viewBox": "0 -960 960 960",
  "paths": {
    "fill0": "M444-360h72q9 0 15.5-7.5T536-384l-19-105q20-10 31.5-29t11.5-42q0-33-23.5-56.5T480-640q-33 0-56.5 23.5T400-560q0 23 11.5 42t31.5 29l-19 105q-2 9 4.5 16.5T444-360Zm23 275q-6-1-12-3-135-45-215-166.5T160-516v-189q0-25 14.5-45t37.5-29l240-90q14-5 28-5t28 5l240 90q23 9 37.5 29t14.5 45v189q0 140-80 261.5T505-88q-6 2-12 3t-13 1q-7 0-13-1Zm13-79q104-33 172-132t68-220v-189l-240-90-240 90v189q0 121 68 220t172 132Zm0-316Z",
    "fill1": "M444-360h72q9 0 15.5-7.5T536-384l-19-105q20-10 31.5-29t11.5-42q0-33-23.5-56.5T480-640q-33 0-56.5 23.5T400-560q0 23 11.5 42t31.5 29l-19 105q-2 9 4.5 16.5T444-360Zm23 275q-6-1-12-3-135-45-215-166.5T160-516v-189q0-25 14.5-45t37.5-29l240-90q14-5 28-5t28 5l240 90q23 9 37.5 29t14.5 45v189q0 140-80 261.5T505-88q-6 2-12 3t-13 1q-7 0-13-1Z"
  },
  "tags": [
    "encrypted"
  ]
}
