{
  "name": "position_top_right",
  "style": "rounded",
  "viewBox": "0 -960 960 960",
  "paths": {
    "fill0": "M200-120q-33 0-56.5-23.5T120-200v-560q0-33 23.5-56.5T200-840h560q33 0 56.5 23.5T840-760v560q0 33-23.5 56.5T760-120H200Zm0-80h560v-560H200v560Zm0-560v560-560Zm220 200h240q25 0 42.5-17.5T720-620q0-25-17.5-42.5T660-680H420q-25 0-42.5 17.5T360-620q0 25 17.5 42.5T420-560Z",
    "fill1": "M200-120q-33 0-56.5-23.5T120-200v-560q0-33 23.5-56.5T200-840h560q33 0 56.5 23.5T840-760v560q0 33-23.5 56.5T760-120H200Zm220-440h240q25 0 42.5-17.5T720-620q0-25-17.5-42.5T660-680H420q-25 0-42.5 17.5T360-620q0 25 17.5 42.5T420-560Z"
  },
  "tags": [
    "position",
    "top",
    "right"
  ]
}
