{
  "name": "keyboard_onscreen",
  "style": "rounded",
  "viewBox": "0 -960 960 960",
  "paths": {
    "fill0": "M360-280h240q17 0 28.5-11.5T640-320q0-17-11.5-28.5T600-360H360q-17 0-28.5 11.5T320-320q0 17 11.5 28.5T360-280ZM160-160q-33 0-56.5-23.5T80-240v-480q0-33 23.5-56.5T160-800h640q33 0 56.5 23.5T880-720v480q0 33-23.5 56.5T800-160H160Zm0-440h640v-120H160v120Zm0 360h640v-280H160v280Zm0 0v-280 280Zm108.5-171.5Q280-423 280-440t-11.5-28.5Q257-480 240-480t-28.5 11.5Q200-457 200-440t11.5 28.5Q223-400 240-400t28.5-11.5Zm120 0Q400-423 400-440t-11.5-28.5Q377-480 360-480t-28.5 11.5Q320-457 320-440t11.5 28.5Q343-400 360-400t28.5-11.5Zm120 0Q520-423 520-440t-11.5-28.5Q497-480 480-480t-28.5 11.5Q440-457 440-440t11.5 28.5Q463-400 480-400t28.5-11.5Zm120 0Q640-423 640-440t-11.5-28.5Q617-480 600-480t-28.5 11.5Q560-457 560-440t11.5 28.5Q583-400 600-400t28.5-11.5Zm120 0Q760-423 760-440t-11.5-28.5Q737-480 720-480t-28.5 11.5Q680-457 680-440t11.5 28.5Q703-400 720-400t28.5-11.5Z",
    "fill1": "M360-280h240q17 0 28.5-11.5T640-320q0-17-11.5-28.5T600-360H360q-17 0-28.5 11.5T320-320q0 17 11.5 28.5T360-280ZM160-160q-33 0-56.5-23.5T80-240v-480q0-33 23.5-56.5T160-800h640q33 0 56.5 23.5T880-720v480q0 33-23.5 56.5T800-160H160Zm0-440h640v-120H160v120Zm108.5 188.5Q280-423 280-440t-11.5-28.5Q257-480 240-480t-28.5 11.5Q200-457 200-440t11.5 28.5Q223-400 240-400t28.5-11.5Zm120 0Q400-423 400-440t-11.5-28.5Q377-480 360-480t-28.5 11.5Q320-457 320-440t11.5 28.5Q343-400 360-400t28.5-11.5Zm120 0Q520-423 520-440t-11.5-28.5Q497-480 480-480t-28.5 11.5Q440-457 440-440t11.5 28.5Q463-400 480-400t28.5-11.5Zm120 0Q640-423 640-440t-11.5-28.5Q617-480 600-480t-28.5 11.5Q560-457 560-440t11.5 28.5Q583-400 600-400t28.5-11.5Zm120 0Q760-423 760-440t-11.5-28.5Q737-480 720-480t-28.5 11.5Q680-457 680-440t11.5 28.5Q703-400 720-400t28.5-11.5Z"
  },
  "tags": [
    "keyboard",
    "onscreen"
  ]
}
