{
  "name": "medication",
  "style": "outlined",
  "viewBox": "0 -960 960 960",
  "paths": {
    "fill0": "M420-260h120v-100h100v-120H540v-100H420v100H320v120h100v100ZM280-120q-33 0-56.5-23.5T200-200v-440q0-33 23.5-56.5T280-720h400q33 0 56.5 23.5T760-640v440q0 33-23.5 56.5T680-120H280Zm0-80h400v-440H280v440Zm-40-560v-80h480v80H240Zm40 120v440-440Z",
    "fill1": "M420-260h120v-100h100v-120H540v-100H420v100H320v120h100v100ZM280-120q-33 0-56.5-23.5T200-200v-440q0-33 23.5-56.5T280-720h400q33 0 56.5 23.5T760-640v440q0 33-23.5 56.5T680-120H280Zm-40-640v-80h480v80H240Z"
  },
  "tags": [
    "medication"
  ]
}
