{
  "name": "background_grid_small",
  "style": "sharp",
  "viewBox": "0 -960 960 960",
  "paths": {
    "fill0": "M200-200h80v-80h-80v80Zm160 0h80v-80h-80v80Zm160 0h80v-80h-80v80Zm160 0h80v-80h-80v80ZM200-680h80v-80h-80v80Zm0 160h80v-80h-80v80Zm0 160h80v-80h-80v80Zm160-320h80v-80h-80v80Zm0 160h80v-80h-80v80Zm0 160h80v-80h-80v80Zm160-320h80v-80h-80v80Zm0 160h80v-80h-80v80Zm0 160h80v-80h-80v80Zm160-320h80v-80h-80v80Zm0 160h80v-80h-80v80Zm0 160h80v-80h-80v80ZM120-120v-720h720v720H120Z",
    "fill1": "M120-120h120v-120H120v120Zm200 0h120v-120H320v120Zm200 0h120v-120H520v120Zm200 0h120v-120H720v120ZM120-720h120v-120H120v120Zm0 200h120v-120H120v120Zm0 200h120v-120H120v120Zm200-400h120v-120H320v120Zm0 200h120v-120H320v120Zm0 200h120v-120H320v120Zm200-400h120v-120H520v120Zm0 200h120v-120H520v120Zm0 200h120v-120H520v120Zm200-400h120v-120H720v120Zm0 200h120v-120H720v120Zm0 200h120v-120H720v120Z"
  },
  "tags": [
    "background",
    "grid",
    "small"
  ]
}
