{
  "name": "sports_volleyball",
  "style": "sharp",
  "viewBox": "0 -960 960 960",
  "paths": {
    "fill0": "M782-582q-31-87-101-145.5T520-798v64l262 152ZM320-434l120-70v-294q-32 3-62 14.5T320-756v322Zm-134 78 54-32v-302q-39 44-59.5 98T160-480q0 32 6.5 63.5T186-356Zm134 152 280-160-120-70-254 148q20 25 43 46t51 36Zm160 44q75 0 142-34t112-94l-54-30-264 152q16 3 32 4.5t32 1.5Zm294-196q13-29 19.5-60.5T800-480L520-642v138l254 148ZM480-480Zm0 400q-83 0-156-31.5T197-197q-54-54-85.5-127T80-480q0-83 31.5-156T197-763q54-54 127-85.5T480-880q83 0 156 31.5T763-763q54 54 85.5 127T880-480q0 83-31.5 156T763-197q-54 54-127 85.5T480-80Z",
    "fill1": "M864-592 520-791v-87q123 12 216 90.5T864-592ZM270-404v-416q39-23 82-38t89-20v375l-171 99Zm-154 89q-18-38-27-79.5T80-480q0-77 28-147.5T190-754v395l-74 44Zm176 187q-42-20-76-50t-60-68l325-188 171 99-360 207Zm189 48q-23 0-47-2.5T388-91l344-198 74 41q-57 78-142.5 123T481-80Zm364-236L520-503v-197l360 209q0 46-8 90t-27 85Z"
  },
  "tags": [
    "sports",
    "volleyball"
  ]
}
