{
  "name": "devices",
  "style": "outlined",
  "viewBox": "0 -960 960 960",
  "paths": {
    "fill0": "M480-540ZM80-160v-80h400v80H80Zm120-120q-33 0-56.5-23.5T120-360v-360q0-33 23.5-56.5T200-800h560q33 0 56.5 23.5T840-720H200v360h280v80H200Zm600 40v-320H640v320h160Zm-180 80q-25 0-42.5-17.5T560-220v-360q0-25 17.5-42.5T620-640h200q25 0 42.5 17.5T880-580v360q0 25-17.5 42.5T820-160H620Zm100-300q13 0 21.5-9t8.5-21q0-13-8.5-21.5T720-520q-12 0-21 8.5t-9 21.5q0 12 9 21t21 9Zm0 60Z",
    "fill1": "M200-280q-33 0-56.5-23.5T120-360v-360q0-33 23.5-56.5T200-800h560q33 0 56.5 23.5T840-720H620q-58 0-99 41t-41 99v300H200Zm420 120q-25 0-42.5-17.5T560-220v-360q0-25 17.5-42.5T620-640h200q25 0 42.5 17.5T880-580v360q0 25-17.5 42.5T820-160H620Zm-540 0v-80h400v80H80Zm640-300q13 0 21.5-9t8.5-21q0-13-8.5-21.5T720-520q-12 0-21 8.5t-9 21.5q0 12 9 21t21 9Z"
  },
  "tags": [
    "devices"
  ]
}
