{
  "name": "circle",
  "style": "rounded",
  "viewBox": "0 -960 960 960",
  "paths": {
    "fill0": "M480-80q-83 0-156-31.5T197-197q-54-54-85.5-127T80-480q0-83 31.5-156T197-763q54-54 127-85.5T480-880q83 0 156 31.5T763-763q54 54 85.5 127T880-480q0 83-31.5 156T763-197q-54 54-127 85.5T480-80Zm0-80q134 0 227-93t93-227q0-134-93-227t-227-93q-134 0-227 93t-93 227q0 134 93 227t227 93Zm0-320Z",
    "fill1": "M480-80q-83 0-156-31.5T197-197q-54-54-85.5-127T80-480q0-83 31.5-156T197-763q54-54 127-85.5T480-880q83 0 156 31.5T763-763q54 54 85.5 127T880-480q0 83-31.5 156T763-197q-54 54-127 85.5T480-80Z"
  },
  "tags": [
    "circle"
  ]
}
