{
  "name": "tactic",
  "style": "sharp",
  "viewBox": "0 -960 960 960",
  "paths": {
    "fill0": "m656-120-56-56 63-64-63-63 56-57 64 64 63-64 57 57-64 63 64 64-57 56-63-63-64 63Zm-387.5-91.5Q280-223 280-240t-11.5-28.5Q257-280 240-280t-28.5 11.5Q200-257 200-240t11.5 28.5Q223-200 240-200t28.5-11.5ZM240-120q-50 0-85-35t-35-85q0-50 35-85t85-35q37 0 67.5 20.5T352-284q39-11 63.5-43t24.5-73v-160q0-83 58.5-141.5T640-760h46l-63-63 57-57 160 160-160 160-57-56 63-64h-46q-50 0-85 35t-35 85v160q0 73-47 128.5T354-203q-12 37-43.5 60T240-120Zm-64-480-56-56 63-64-63-63 56-57 64 64 63-64 57 57-64 63 64 64-57 56-63-63-64 63Z",
    "fill1": "m656-120-56-56 63-64-63-63 56-57 64 64 63-64 57 57-64 63 64 64-57 56-63-63-64 63Zm-387.5-91.5Q280-223 280-240t-11.5-28.5Q257-280 240-280t-28.5 11.5Q200-257 200-240t11.5 28.5Q223-200 240-200t28.5-11.5ZM240-120q-50 0-85-35t-35-85q0-50 35-85t85-35q37 0 67.5 20.5T352-284q39-11 63.5-43t24.5-73v-160q0-83 58.5-141.5T640-760h46l-63-63 57-57 160 160-160 160-57-56 63-64h-46q-50 0-85 35t-35 85v160q0 73-47 128.5T354-203q-12 37-43.5 60T240-120Zm-64-480-56-56 63-64-63-63 56-57 64 64 63-64 57 57-64 63 64 64-57 56-63-63-64 63Z"
  },
  "tags": [
    "tactic"
  ]
}
